{
  "core": "boom",
  "sim": "verilator",
  "program": {
    "kind": "asm",
    "path": "/abs/path/to/benchmarks/rob_stall.S"
  },
  "memory_map": {
    "base": "0x80000000",
    "size": 1048576,
    "stride": 4096
  },
  "injection": {
    "resource": "ROB",
    "strategy": "block_commit_or_reclaim",
    "start_cycle": 2000,
    "duration": 5000
  },
  "resources": ["ROB", "LSQ"]
}
